{
  "$schema": "https://json-schema.org/draft/2020-12/schema",
  "$id": "https://marketplace-central.local/governance/modules.schema.json",
  "type": "object",
  "additionalProperties": false,
  "required": ["schema_version", "registry_id", "modules", "temporary_exceptions"],
  "properties": {
    "schema_version": { "const": "1.0" },
    "registry_id": { "const": "modules" },
    "modules": {
      "type": "array",
      "minItems": 1,
      "uniqueItems": true,
      "items": {
        "type": "object",
        "additionalProperties": false,
        "required": [
          "id",
          "root",
          "code_owner_path",
          "composition_required",
          "openapi_prefixes",
          "dependencies"
        ],
        "properties": {
          "id": { "type": "string", "pattern": "^[a-z][a-z0-9_]*$" },
          "kind": {
            "type": "string",
            "enum": ["module", "context"],
            "description": "Absent means module, so the existing entries need no edit. A context lives under internal/contexts and follows ADR-023 as amended: its layers sit under internal/, so the boundary is the compiler and not a convention. Uniqueness is on the pair (kind, id) because internal/modules/catalog and internal/contexts/catalog coexist for the whole migration."
          },
          "root": { "$ref": "#/$defs/path" },
          "code_owner_path": { "$ref": "#/$defs/path" },
          "composition_required": { "type": "boolean" },
          "openapi_prefixes": {
            "type": "array",
            "uniqueItems": true,
            "items": { "type": "string", "pattern": "^/[a-z0-9][a-z0-9/-]*$" }
          },
          "dependencies": {
            "type": "array",
            "uniqueItems": true,
            "items": { "type": "string", "pattern": "^[a-z][a-z0-9_]*$" }
          }
        }
      }
    },
    "temporary_exceptions": {
      "type": "array",
      "uniqueItems": true,
      "items": {
        "type": "object",
        "additionalProperties": false,
        "required": [
          "id",
          "rule_id",
          "source_module",
          "target_module",
          "target_layer",
          "path",
          "import_path",
          "reason",
          "removal_owner"
        ],
        "properties": {
          "id": { "$ref": "#/$defs/id" },
          "rule_id": { "$ref": "#/$defs/id" },
          "source_module": { "type": "string", "pattern": "^[a-z][a-z0-9_]*$" },
          "target_module": { "type": "string", "pattern": "^[a-z][a-z0-9_]*$" },
          "target_layer": { "enum": ["adapters", "transport", "registry"] },
          "path": { "$ref": "#/$defs/path" },
          "import_path": {
            "type": "string",
            "pattern": "^marketplace-central/apps/server_core/internal/modules/[a-z0-9_/-]+$"
          },
          "reason": { "type": "string", "minLength": 1 },
          "removal_owner": { "type": "string", "pattern": "^M-[0-9]{2}(?:/F-[0-9]{2})?$" }
        }
      }
    }
  },
  "$defs": {
    "id": { "type": "string", "pattern": "^[a-z0-9][a-z0-9-]*$" },
    "path": { "type": "string", "pattern": "^(?!/)(?!.*(?:^|/)\\.\\.(?:/|$))[A-Za-z0-9._/-]+$" }
  }
}
