{
  "schema_version": "1.0",
  "registry_id": "modules",
  "modules": [
    { "id": "catalog", "root": "apps/server_core/internal/modules/catalog", "code_owner_path": "apps/server_core/internal/modules/catalog", "composition_required": true, "openapi_prefixes": ["/catalog"], "dependencies": ["internal_read"] },
    { "id": "classifications", "root": "apps/server_core/internal/modules/classifications", "code_owner_path": "apps/server_core/internal/modules/classifications", "composition_required": true, "openapi_prefixes": ["/classifications"], "dependencies": [] },
    { "id": "connectors", "root": "apps/server_core/internal/modules/connectors", "code_owner_path": "apps/server_core/internal/modules/connectors", "composition_required": true, "openapi_prefixes": ["/connectors"], "dependencies": ["integrations", "marketplaces", "pricing"] },
    { "id": "dashboard", "root": "apps/server_core/internal/modules/dashboard", "code_owner_path": "apps/server_core/internal/modules/dashboard", "composition_required": true, "openapi_prefixes": ["/dashboard"], "dependencies": ["erp_import", "integrations", "listings", "orders", "product_links"] },
    { "id": "erp_import", "root": "apps/server_core/internal/modules/erp_import", "code_owner_path": "apps/server_core/internal/modules/erp_import", "composition_required": true, "openapi_prefixes": ["/erp/imports"], "dependencies": ["catalog", "internal_read", "integrations", "product_links", "sync"] },
    { "id": "integrations", "root": "apps/server_core/internal/modules/integrations", "code_owner_path": "apps/server_core/internal/modules/integrations", "composition_required": true, "openapi_prefixes": ["/integrations", "/sync"], "dependencies": ["connectors", "marketplaces"] },
    { "id": "internal_read", "root": "apps/server_core/internal/modules/internal_read", "code_owner_path": "apps/server_core/internal/modules/internal_read", "composition_required": true, "openapi_prefixes": [], "dependencies": ["catalog", "inventory"] },
    { "id": "inventory", "root": "apps/server_core/internal/modules/inventory", "code_owner_path": "apps/server_core/internal/modules/inventory", "composition_required": true, "openapi_prefixes": ["/inventory"], "dependencies": ["connectors", "integrations", "internal_read", "listings", "mutations", "product_links"] },
    { "id": "listings", "root": "apps/server_core/internal/modules/listings", "code_owner_path": "apps/server_core/internal/modules/listings", "composition_required": false, "openapi_prefixes": ["/listings"], "dependencies": ["connectors", "integrations", "internal_read", "marketplaces"] },
    { "id": "market", "root": "apps/server_core/internal/modules/market", "code_owner_path": "apps/server_core/internal/modules/market", "composition_required": true, "openapi_prefixes": ["/market"], "dependencies": [] },
    { "id": "marketplaces", "root": "apps/server_core/internal/modules/marketplaces", "code_owner_path": "apps/server_core/internal/modules/marketplaces", "composition_required": true, "openapi_prefixes": ["/admin/fee-schedules", "/marketplaces"], "dependencies": [] },
    { "id": "mutations", "root": "apps/server_core/internal/modules/mutations", "code_owner_path": "apps/server_core/internal/modules/mutations", "composition_required": true, "openapi_prefixes": ["/mutations"], "dependencies": ["connectors", "listings", "marketplaces", "product_links"] },
    { "id": "orders", "root": "apps/server_core/internal/modules/orders", "code_owner_path": "apps/server_core/internal/modules/orders", "composition_required": true, "openapi_prefixes": ["/orders"], "dependencies": ["connectors", "internal_read", "product_links"] },
    { "id": "pricing", "root": "apps/server_core/internal/modules/pricing", "code_owner_path": "apps/server_core/internal/modules/pricing", "composition_required": true, "openapi_prefixes": ["/pricing"], "dependencies": ["catalog", "internal_read", "marketplaces"] },
    { "id": "product_links", "root": "apps/server_core/internal/modules/product_links", "code_owner_path": "apps/server_core/internal/modules/product_links", "composition_required": true, "openapi_prefixes": ["/product-links"], "dependencies": ["connectors", "internal_read"] },
    { "id": "profitability", "root": "apps/server_core/internal/modules/profitability", "code_owner_path": "apps/server_core/internal/modules/profitability", "composition_required": true, "openapi_prefixes": ["/profitability"], "dependencies": ["internal_read", "orders"] },
    { "id": "sync", "root": "apps/server_core/internal/modules/sync", "code_owner_path": "apps/server_core/internal/modules/sync", "composition_required": true, "openapi_prefixes": [], "dependencies": [] },
    { "id": "tenant_config", "root": "apps/server_core/internal/modules/tenant_config", "code_owner_path": "apps/server_core/internal/modules/tenant_config", "composition_required": true, "openapi_prefixes": ["/config"], "dependencies": ["erp_import"] }
  ],
  "temporary_exceptions": [
    {
      "id": "module-edge-connectors-magalu-integrations-adapter",
      "rule_id": "module-target-layer",
      "source_module": "connectors",
      "target_module": "integrations",
      "target_layer": "adapters",
      "path": "apps/server_core/internal/modules/connectors/adapters/magalu/fee_seed.go",
      "import_path": "marketplace-central/apps/server_core/internal/modules/integrations/adapters/providers",
      "reason": "Current connector fee seed imports the integration provider adapter registry.",
      "removal_owner": "M-10"
    },
    {
      "id": "module-edge-connectors-mercado-livre-integrations-adapter",
      "rule_id": "module-target-layer",
      "source_module": "connectors",
      "target_module": "integrations",
      "target_layer": "adapters",
      "path": "apps/server_core/internal/modules/connectors/adapters/mercado_livre/fee_sync.go",
      "import_path": "marketplace-central/apps/server_core/internal/modules/integrations/adapters/providers",
      "reason": "Current connector fee sync imports the integration provider adapter registry.",
      "removal_owner": "M-10"
    },
    {
      "id": "module-edge-connectors-shopee-integrations-adapter",
      "rule_id": "module-target-layer",
      "source_module": "connectors",
      "target_module": "integrations",
      "target_layer": "adapters",
      "path": "apps/server_core/internal/modules/connectors/adapters/shopee/fee_seed.go",
      "import_path": "marketplace-central/apps/server_core/internal/modules/integrations/adapters/providers",
      "reason": "Current connector fee seed imports the integration provider adapter registry.",
      "removal_owner": "M-10"
    },
    {
      "id": "module-edge-integrations-feesync-marketplaces-registry",
      "rule_id": "module-target-layer",
      "source_module": "integrations",
      "target_module": "marketplaces",
      "target_layer": "registry",
      "path": "apps/server_core/internal/modules/integrations/adapters/feesync/marketplace_executor.go",
      "import_path": "marketplace-central/apps/server_core/internal/modules/marketplaces/registry",
      "reason": "Current fee-sync adapter imports the marketplace registry implementation.",
      "removal_owner": "M-10"
    },
    {
      "id": "module-edge-tenant-config-erp-import-adapter",
      "rule_id": "module-target-layer",
      "source_module": "tenant_config",
      "target_module": "erp_import",
      "target_layer": "adapters",
      "path": "apps/server_core/internal/modules/tenant_config/active_source.go",
      "import_path": "marketplace-central/apps/server_core/internal/modules/erp_import/adapters/internalread",
      "reason": "active_source.go republishes exactly one symbol from erp_import's adapters layer: var ErrUnknownActiveSource = internalread.ErrUnknownActiveSource. Measured, not assumed — the entry trades GOV_MODULE_COVERAGE tenant_config for this one named edge (main tip baseline 55 violations, this tree 54 — strict subset, zero new). The sentinel belongs in a shared errors seam; until the error surface is unified it lives where the reader can reach it. Unification work is queued as CHIP-ERROR-UNIFY.",
      "removal_owner": "M-10"
    }
  ]
}
